{
  "schema_version": "1.0",
  "manifest_id": "npi-manifest-g0-fixtures-v1",
  "data_gate": "G0_THREE_SYNTHETIC_FIXTURES",
  "created_at": "2026-07-12T00:00:00Z",
  "source_root_fingerprint": "packaged-fixture-root-v1",
  "max_assets": 3,
  "assets": [
    {
      "asset_ref": "fixture-1",
      "source_relative_path": "three_image_smoke_set/fixture_a_corridor_abstract.png",
      "expected_sha256": "ff0ec4d4baeb0a83495afaa62b65dc58110d83f9e2da14fd19e4d50959430157",
      "size_bytes": 2702,
      "media_type": "image/png"
    },
    {
      "asset_ref": "fixture-2",
      "source_relative_path": "three_image_smoke_set/fixture_a_exact_copy.png",
      "expected_sha256": "ff0ec4d4baeb0a83495afaa62b65dc58110d83f9e2da14fd19e4d50959430157",
      "size_bytes": 2702,
      "media_type": "image/png"
    },
    {
      "asset_ref": "fixture-3",
      "source_relative_path": "three_image_smoke_set/fixture_b_tonal_abstract.png",
      "expected_sha256": "9544c610264418316c22143442e8a3e308e076eca2f19d0e51cf67baa3489097",
      "size_bytes": 2439,
      "media_type": "image/png"
    }
  ],
  "approval_reference": "PROJECT_STATE.json:N0/G0",
  "allowed_phases": [
    "N0",
    "N1"
  ],
  "expires_at": null
}
